{
  "$schema": "https://json-schema.org/draft/2020-12/schema",
  "title": "dsh-skill-presets sources",
  "type": "array",
  "items": {
    "type": "object",
    "additionalProperties": false,
    "required": [
      "id",
      "title",
      "kind",
      "enabled"
    ],
    "properties": {
      "id": {
        "type": "string",
        "pattern": "^[a-z0-9][a-z0-9._-]*$"
      },
      "title": {
        "type": "string"
      },
      "kind": {
        "enum": [
          "github",
          "local"
        ]
      },
      "repo": {
        "type": "string",
        "pattern": "^[A-Za-z0-9_.-]+/[A-Za-z0-9_.-]+$"
      },
      "ref": {
        "type": "string"
      },
      "paths": {
        "type": "array",
        "items": {
          "type": "string"
        }
      },
      "skills": {
        "description": "Install exactly these skill directories instead of scanning `paths`.",
        "type": "array",
        "items": {
          "type": "object",
          "additionalProperties": false,
          "required": [
            "path"
          ],
          "properties": {
            "path": {
              "type": "string"
            }
          }
        }
      },
      "enabled": {
        "type": "boolean"
      },
      "note": {
        "type": "string"
      }
    }
  }
}
