[
  {
    "id": "addyosmani-agent-skills",
    "title": "addyosmani/agent-skills",
    "kind": "github",
    "repo": "addyosmani/agent-skills",
    "paths": [
      "skills"
    ],
    "enabled": true,
    "note": "Production-grade engineering skills; MIT."
  },
  {
    "id": "obra-superpowers",
    "title": "obra/superpowers",
    "kind": "github",
    "repo": "obra/superpowers",
    "paths": [
      "skills"
    ],
    "enabled": true,
    "note": "Process skills: brainstorming, plans, TDD, worktrees, review; MIT."
  },
  {
    "id": "mattpocock-skills",
    "title": "mattpocock/skills",
    "kind": "github",
    "repo": "mattpocock/skills",
    "paths": [
      "skills/engineering",
      "skills/productivity"
    ],
    "enabled": true,
    "note": "Engineering and productivity skills; `in-progress` and `misc` are excluded by default."
  },
  {
    "id": "humanlayer-skills",
    "title": "humanlayer/skills (show-me)",
    "kind": "github",
    "repo": "humanlayer/skills",
    "ref": "main",
    "skills": [
      {
        "path": "plugins/show-me/skills/show-me"
      }
    ],
    "enabled": true,
    "note": "`show-me` by Dex Horthy / HumanLayer: explains the current topic visually (diagrams, code-shape sketches, focused HTML). User-invoked: upstream sets disable-model-invocation."
  },
  {
    "id": "local",
    "title": "Local (this workbench)",
    "kind": "local",
    "enabled": true,
    "note": "Hand-written skills, including the SDLC practice skills seeded by dsh-skill-presets."
  }
]
